{
  "fixture_id": "memory_deleted_blocked",
  "contract_version": "p0-contract-v1",
  "required_phase": "P8",
  "input": {
    "memory_status": "deleted",
    "query_related": true
  },
  "expected": {
    "outcome": "rejected",
    "code": "memory_not_retrievable",
    "writes": [],
    "provider_call_count": 0,
    "notes": [
      "other user excluded",
      "other world excluded"
    ]
  },
  "variants": [
    "missing_required_field",
    "length_or_enum_exceeded",
    "foreign_key_missing",
    "duplicate_idempotency",
    "deleted_source",
    "inactive_membership",
    "stale_contract_hash"
  ]
}
