{
  "fixture_id": "community_profile_success",
  "contract_version": "p0-contract-v1",
  "required_phase": "P2",
  "input": {
    "world_generation_context_fixture_id": "world_generation_context_sanitized",
    "world_character_id": "world-character-a",
    "character_contract_hash": "aaaaaaaaaaaaaaaaaaaaaaaaaaaaaaaaaaaaaaaaaaaaaaaaaaaaaaaaaaaaaaaa",
    "world_contract_hash": "bbbbbbbbbbbbbbbbbbbbbbbbbbbbbbbbbbbbbbbbbbbbbbbbbbbbbbbbbbbbbbbb",
    "core_interest_count": 3,
    "adjacent_interest_count": 2,
    "search_keyword_count": 8,
    "action_keys": ["comment", "reply", "like", "repost", "follow", "unfollow", "observe"]
  },
  "expected": {
    "outcome": "success",
    "code": "community_profile_draft_ready",
    "writes": ["world_community_profile:draft"],
    "provider_call_count": 1,
    "notes": ["repertoire not ready", "autonomy disabled"]
  },
  "variants": [
    "missing_required_field",
    "length_or_enum_exceeded",
    "foreign_key_missing",
    "duplicate_idempotency",
    "deleted_source",
    "inactive_membership",
    "stale_contract_hash"
  ]
}
