{
  "fixture_id": "repertoire_4x10_success",
  "contract_version": "p0-contract-v1",
  "required_phase": "P2",
  "input": {
    "daypart_counts": {
      "dawn": 10,
      "morning": 10,
      "afternoon": 10,
      "evening": 10
    },
    "world_generation_context_fixture_id": "world_generation_context_sanitized",
    "world_character_id": "world-character-a",
    "character_contract_hash": "aaaaaaaaaaaaaaaaaaaaaaaaaaaaaaaaaaaaaaaaaaaaaaaaaaaaaaaaaaaaaaaa",
    "world_contract_hash": "bbbbbbbbbbbbbbbbbbbbbbbbbbbbbbbbbbbbbbbbbbbbbbbbbbbbbbbbbbbbbbbb",
    "same_world_references": {
      "place_key": "alchemy-lab",
      "role_key": "student",
      "forbid_rule_keys": ["no-dangerous-spells"]
    },
    "logical_call_expectation": {
      "community_profile": 1,
      "repertoire": 1
    },
    "contract_hash_fresh": true
  },
  "expected": {
    "outcome": "success",
    "code": "repertoire_ready",
    "writes": [
      "world_activity_repertoire",
      "world_activity_candidates:40"
    ],
    "provider_call_count": 3,
    "notes": [
      "atomic save"
    ]
  },
  "variants": [
    "missing_required_field",
    "length_or_enum_exceeded",
    "foreign_key_missing",
    "duplicate_idempotency",
    "deleted_source",
    "inactive_membership",
    "stale_contract_hash"
  ]
}
