{
  "fixture_id": "world_banner_only_hash_stable",
  "contract_version": "p0-contract-v1",
  "required_phase": "P1",
  "input": {"change": "managed_banner"},
  "expected": {
    "outcome": "success",
    "code": "world_contract_hash_stable",
    "writes": ["world", "managed_media"],
    "provider_call_count": 0,
    "notes": ["row_version increments", "definition_version remains stable"]
  },
  "variants": ["missing_required_field", "length_or_enum_exceeded", "foreign_key_missing", "duplicate_idempotency", "deleted_source", "inactive_membership", "stale_contract_hash"]
}
